{"schema_version":"1.0","discrepancy_id":"discrepancy-equipment-001","tenant_id":"tenant-hctm","world_run_id":"world-run-genesis-001","branch_id":"main","subject_ref":{"namespace":"hctm","type":"equipment","code":"LAS-WLD-02"},"kind":"world_vs_iaos","world_fact_ref":"world-event-vibration-rise-01","status":"open","detected_at":"2026-07-08T10:16:00+08:00","correlation_id":"corr-equipment-degradation-01"}
